Priority|Details|Status|Deadline|Completed|Project
1|Fermentum metus. aenean sed pede nec ante bland.|Completed|1601125006|1600945857|Cursus Associates
2|Suspendisse non leo. vivamus nibh dolor, nonumm.|In pending|1604790887||Vehicula PC
3|Eget metus. in nec orci. donec nibh. quisque no.|In progress|1606689914||Euismod
3|Nulla semper tellus id nunc interdum feugiat. s.|Completed|1604626670|1604447521|Eu Ultrices
1|Mollis non, cursus non, egestas a, dui. cras pe.|In progress|1604689581||Magna Malesuada
2|Pede, malesuada vel, venenatis vel, faucibus id.|In progress|1607920118||Mauris Institute
2|Tellus. nunc lectus pede, ultrices a, auctor no.|Completed|1609187659|1609008510|Magna Malesuada
3|Sagittis. duis gravida. praesent eu nulla at se.|Completed|1603618469|1603439320|Ornare Ltd
2|Sapien. cras dolor dolor, tempus non, lacinia a.|In progress|1602982591||Quam Institute
2|Egestas hendrerit neque. in ornare sagittis fel.|Assigned|1603263031||Lobortis
1|Purus. duis elementum, dui quis accumsan conval.|Assigned|1600792612||Eu Ultrices
1|Nec, leo. morbi neque tellus, imperdiet non, ve.|In pending|1605984547||Lobortis
2|Luctus ut, pellentesque eget, dictum placerat, .|Assigned|1607117630||Vehicula PC
1|Dolor, nonummy ac,.|In pending|1608235256||In Incorporated
1|Hendrerit a, arcu. sed et libero. proin mi. ali.|In progress|1609098069||Quam Institute
3|Lorem ac risus. morbi metus. vivamus.|In pending|1600401866||Euismod
2|Luctus et ultrices posuere cubilia curae; donec.|In progress|1605901491||Magna Malesuada
1|Eros nec tellus. nunc lectus pede, ultrices a, .|Completed|1602905857|1602726708|Vehicula PC
1|Quis, pede. praesent eu dui. cum sociis natoque.|In progress|1602047093||Euismod
3|Et malesuada fames.|In progress|1600386136||Amet Ultricies
1|Bibendum sed, est. nunc laoreet lectus quis mas.|Assigned|1605780624||Quam Institute
3|Duis elementum, dui quis accumsan convallis, an.|Assigned|1601803033||Vehicula Tincidunt
3|Cursus luctus, ipsum leo elementum sem, vitae a.|In pending|1608452212||Quam Institute
1|Magna. lorem ipsum dolor sit amet, consectetuer.|In progress|1603269962||Vehicula Tincidunt
2|Sodales nisi magna sed dui. fusce aliquam, enim.|In pending|1606359113||Mauris Institute
3|Nulla aliquet. proin velit. sed malesuada augue.|Completed|1600767546|1600588397|Non Inc.
3|Ipsum cursus vestibulum. mauris magna. duis dig.|Assigned|1609727591||Lobortis
2|Non lorem vitae odio sagittis semper..|Assigned|1605761154||Eu Ultrices
2|Vel, mauris. integer sem elit, pharetra ut, pha.|Completed|1605797300|1605618151|Mauris Institute
1|Risus. donec egestas. duis ac.|In progress|1603628518||Cursus Associates
2|Sapien. cras dolor dolor, tempus non, lacinia a.|In progress|1609275945||Euismod
2|Vel, convallis in, cursus et, eros. proin ultri.|Completed|1602273685|1602094536|Cursus Associates
1|Nulla magna, malesuada vel, convallis in, cursu.|Completed|1608291938|1608112789|Euismod
3|Dignissim pharetra. nam ac nulla. in tincidunt .|In progress|1606280784||Vehicula PC
3|Eget magna. suspendisse tristique neque venenat.|In progress|1602488334||Ornare Ltd
3|Commodo hendrerit. donec porttitor tellus non m.|Assigned|1607644951||Magna Malesuada
3|Eget tincidunt.|Canceled|1606923205||Magna Malesuada
1|Duis elementum, dui quis accumsan convallis, an.|In pending|1600471772||Lobortis
2|Donec egestas. aliquam nec enim. nunc ut erat. .|Canceled|1607942382||In Incorporated
3|Arcu. morbi sit amet massa. quisque porttitor.|In progress|1605213872||Eu Ultrices
1|Enim. sed nulla ante, iaculis nec, eleifend non.|Completed|1605763545|1605584396|Non Inc.
2|Morbi quis urna. nunc quis arcu vel quam dignis.|Completed|1602183421|1602004272|Non Inc.
3|Pede..|Canceled|1600464192|1600285043|Mauris Institute
1|Natoque penatibus et magnis dis parturient mont.|Assigned|1600933952||Amet Ultricies
1|Montes, nascetur ridiculus mus. proin vel arcu .|In pending|1609993940||Magna Malesuada
3|Neque. morbi quis urna..|Assigned|1600871048||Magna Malesuada
1|Ultricies dignissim lacus. aliquam rutrum lorem.|Completed|1607370913|1607191764|Mauris Institute
2|A nunc. in at pede. cras vulputate velit eu sem.|In pending|1607087963||Vehicula PC
3|Cum sociis natoque penatibus et magnis dis part.|In progress|1606691289||Non Inc.
3|Est, vitae sodales nisi magna sed dui. fusce al.|In pending|1602436621||Euismod
1|Aliquam tincidunt, nunc ac mattis ornare, lectu.|Completed|1609585151|1609406002|Cursus Associates
3|Justo eu arcu. morbi sit amet massa. quisque po.|In progress|1609360434||Mauris Institute
3|Erat semper rutrum. fusce dolor quam, elementum.|Completed|1609181875|1609002726|Lobortis
2|Et ultrices posuere cubilia curae; phasellus or.|In progress|1601891429||Euismod
3|Risus. donec nibh enim, gravida sit amet, dapib.|In progress|1601873543||Euismod
2|Quis massa. mauris.|Completed|1607276391|1607097242|Vehicula Tincidunt
1|Vulputate, posuere vulputate, lacus. cras inter.|In progress|1606102794||Quam Institute
3|Fermentum risus, at fringilla purus mauris a nu.|Canceled|1607353426||Euismod
3|Molestie. sed id.|In progress|1607216979||Eu Ultrices
3|Aliquet diam. sed diam lorem, auctor quis, tris.|Completed|1609931034|1609751885|Ornare Ltd
1|Nisi nibh.|Assigned|1608017217||Quam Institute
2|Ipsum nunc id enim. curabitur massa. vestibulum.|Assigned|1600924019||Quam Institute
3|Nulla facilisi. sed neque. sed eget lacus. maur.|In pending|1609061106||Lobortis
2|Nascetur ridiculus mus. aenean eget magna. susp.|Assigned|1609655001||Vehicula Tincidunt
2|Et magnis dis parturient montes, nascetur ridic.|In pending|1602445122||Eu Ultrices
1|Tellus sem mollis dui, in sodales elit erat vit.|Completed|1609600381|1609421232|Non Inc.
1|Pretium et, rutrum non, hendrerit id, ante. nun.|In pending|1600045397||Lobortis
1|Molestie tortor nibh sit amet orci. ut sagittis.|In pending|1608887665||In Incorporated
1|Sem egestas blandit. nam nulla magna, malesuada.|Completed|1606791986|1606612837|Non Inc.
2|Lobortis tellus justo sit amet nulla. donec non.|In pending|1605724094||Euismod
3|Donec egestas. aliquam nec enim. nunc ut erat. .|Canceled|1602973584||Cursus Associates
1|Nisi. mauris nulla. integer urna. vivamus moles.|In progress|1604137780||Vehicula PC
3|Nunc sollicitudin commodo ipsum. suspendisse no.|Completed|1602212948|1602033799|Ornare Ltd
3|Porttitor tellus non magna. nam ligula.|Completed|1605731561|1605552412|Mauris Institute
3|Elementum sem, vitae aliquam eros turpis non en.|In pending|1608410607||Mauris Institute
3|Sit amet ultricies sem magna nec quam. curabitu.|In pending|1603654052||Ornare Ltd
3|Viverra. donec tempus, lorem fringilla ornare p.|Completed|1606233271|1606054122|Eu Ultrices
3|Ante. vivamus non lorem vitae odio sagittis sem.|Assigned|1603451675||Euismod
2|Donec egestas. aliquam nec enim. nunc ut erat. .|Canceled|1600926620||Cursus Associates
3|Molestie arcu. sed eu nibh vulputate mauris sag.|Assigned|1603752235||Magna Malesuada
3|Ullamcorper eu, euismod ac, fermentum vel, maur.|In progress|1607206931||Cursus Associates
1|Convallis dolor. quisque tincidunt pede ac urna.|In progress|1608655273||Quam Institute
3|Tellus sem mollis dui, in sodales elit erat vit.|Assigned|1609135858||Lobortis
2|Cras eu tellus eu augue porttitor interdum. sed.|In progress|1604768618||In Incorporated
3|Eget tincidunt dui augue eu tellus. phasellus e.|Canceled|1604121850||Amet Ultricies
2|Convallis erat, eget tincidunt dui augue eu tel.|In progress|1607867858||In Incorporated
1|Torquent per conubia nostra, per inceptos hymen.|Canceled|1601650421||Magna Malesuada
2|Venenatis vel, faucibus id, libero. donec conse.|In pending|1600264396||Lobortis
3|Erat nonummy ultricies ornare, elit elit fermen.|Canceled|1608183093||Mauris Institute
2|Nunc nulla vulputate dui, nec tempus mauris era.|Completed|1608742971|1608563822|In Incorporated
1|Vulputate eu, odio. phasellus at augue id.|Assigned|1600571251||Cursus Associates
1|Nam ligula elit, pretium et, rutrum non, hendre.|In progress|1608030244||Vehicula Tincidunt
2|Nunc ac mattis ornare, lectus ante dictum mi, a.|In pending|1602932361||Cursus Associates
3|Urna et arcu imperdiet ullamcorper. duis at lac.|Assigned|1600621492||Mauris Institute
1|Eu erat semper rutrum. fusce dolor quam, elemen.|In pending|1605772244||Cursus Associates
2|Erat volutpat. nulla dignissim. maecenas ornare.|Assigned|1606584675||Cursus Associates
1|Elit sed consequat auctor, nunc nulla vulputate.|In progress|1608100496||Vehicula PC
1|Quisque purus sapien, gravida non, sollicitudin.|Completed|1607707600|1607528451|Vehicula PC
2|Diam vel arcu. curabitur ut odio vel est tempor.|In progress|1605071168||Ornare Ltd
2|Eros. nam consequat dolor vitae dolor. donec fr.|In pending|1607400665||Lobortis
